,time,poi,latitude,longitude
0,2016-05-14 16:34:53,"So Rosas, Largo D. Dinis, 11, Estremoz",38.8420140332,-7.59264707565
1,2016-05-05 16:41:41,"Pizzas Baldracca, Av. da Liberdade, 175, Lisboa",38.7203919304,-9.146088198
2,2016-05-05 16:37:16,"Santini, Mercado da Ribeira, Lisboa",38.707136465,-9.14595847745
3,2016-05-05 16:35:20,"Hamburgueria no Talho, Rua do Sol  Graa, 71, Lisboa",38.718502,-9.1295185
4,2016-03-24 07:40:33,"Le Moustache Smokery, Praa das Flores, 44/45, Lisboa",38.715329,-9.151724
5,2016-03-05 09:12:21,"Ground Burger, Av. Antnio Augusto de Aguiar, 148, Lisboa",38.7354218526,-9.1543258831
6,2016-02-27 18:53:21,"Frutalmeidas, Av. de Roma, 45, Lisboa",38.7467602986,-9.14066173466
7,2016-02-27 18:52:27,"Delta Q, Atrium Saldanha - Praa Duque de Saldanha, 1, Lisboa",38.7325376734,-9.14467781782
8,2016-02-27 18:51:05,"Lacinho, R. Andrade Corvo, 33, Lisboa",38.7302005084,-9.14792060852
9,2016-02-16 17:28:05,"Carvoaria Jacto, R. Maria Andrade, 6-8, Lisboa",38.7231831753,-9.13266864079
10,2016-02-13 01:54:25,"Ourivesaria Portugal, Praa D. Pedro IV, 122, Lisboa",38.7060977343,-9.14426131966
11,2016-02-13 01:53:02,"La Puttana, Rua Nova do Carvalho, 70, Lisboa",38.707471,-9.144383
12,2016-02-13 01:52:04,"Bangla, R. do Benformoso, 147, Lisboa",38.715630836,-9.13495461651
13,2016-02-13 01:51:08,"A Loja no Parque, Rua Dom Francisco Manuel de Melo, 26B, Lisboa",38.7285181586,-9.15833692618
14,2016-02-09 08:09:25,"Kaffeehaus, R. Anchieta, 3, Lisboa",38.7098523912,-9.14113734622
15,2016-02-07 21:25:48,"Manteigaria, Rua do Loreto, 2, Lisboa",38.7106725723,-9.14378028466
16,2016-01-19 18:36:07,"So Tom International Airport (TMS), Aeroporto Internacional de So Tom, So Tom",0.377308979452,6.71453475952
17,2016-01-19 18:31:08,"Bom Bom Island Resort, Ilhu Bom Bom, Santo Antnio",1.69277359177,7.40250689487
18,2015-03-25 08:00:27,"Ink & Wheels, Av. scar Monteiro Torres 6A, Lisboa",38.7425816817,-9.14317494136
19,2015-03-22 19:54:40,"Supermercado Chen, Rua Da Palma, 220, Lisboa",38.7177161999,-9.13565218449
20,2015-03-22 19:53:01,"El Cartel, P. Martim Moniz, Lisboa",38.7161549847,-9.13591504097
21,2015-03-22 19:49:36,"Bolo do Caco Hamburgueria Gourmet, Mercado Fuso, Lisboa",38.716500795,-9.13602467014
22,2015-03-08 17:04:26,"Nobre Tattoo, Travessa do Aougue 10, Lisboa",38.7142845632,-9.13097716892
23,2015-02-22 15:57:27,"Chatuchak Weekend Market, Kamphaeng Phet 2 Rd, 08153808310123",13.7995259062,100.551496065
24,2015-02-22 15:43:17,"Temple of the Emerald Buddha, Na Phra Lan Rd, 1e2330190423",13.7517346437,100.492651463
25,2015-02-22 15:42:18,"1748324023372d1e23302d32173415224c (Phra Arthit Pier) N13, 16.1e23302d32173415224c, 1e2330190423",13.7634999873,100.494132042
26,2015-02-22 15:40:39,"MBK Center, 444 Phaya Thai Rd, 1b173821273119",13.7448907954,100.5301361
27,2015-02-22 15:39:26,"Old Bangkok Inn, 607 Phra Sumen Rd., 1e2330190423",13.7568336126,100.504656782
28,2015-02-22 15:37:24,"Wat Bowonniwet School, 250 Phra Sumen Rd, 1e2330190423",13.75883,100.50184
29,2015-02-22 15:32:31,"1e3127013548, 28 Phra Sumen Rd, 1e2330190423",13.7634293248,100.496260431
30,2015-02-22 15:29:42,"River View Guest House, 768 Soi Phanurangsi, Songvad Road, 1525321419492d22",13.7342259,100.51195345
31,2015-02-22 15:27:35,"Siam Paragon, 991 Rama I Rd, 1b173821273119",13.745992456,100.534442853
32,2015-02-22 15:26:37,"Shee Va, 1619191e23302d32173415224c, Chana Songkhram",13.7627355169,100.497435544
33,2015-02-22 15:25:27,"Phraya Nakhon Cave, 2d3817223219412b48070a321534 4002322a322123492d22222d14, Khao Daeng",12.2054506894,100.010198616
34,2015-02-22 15:23:21,"BamBam Restaurant HuaHin, 2b1949322731142b31272b3419, 2d.2b31272b3419",12.5697486612,99.9587356079
35,2015-02-22 15:22:13,"2a163219352316441f2b31272b3419 (Hua Hin) SRT4118, Phra Pok Klao Rd., 2d3340202d2b31272b3419",12.5674441395,99.9546432495
36,2015-02-22 15:20:21,"PP land resort, 7/20 m.1, 400132301e223221",9.75008858289,98.4177289722
37,2015-02-22 15:16:00,"Wat Phan Tao, 16.23320a143340193419, 4021372d07400a352207432b2148",18.7877125871,98.9878511424
38,2015-02-22 15:11:53,"Chiang Mai Zoo, 100 Huai Kaeo Rd, 4021372d07400a352207432b2148",18.8087104612,98.9471025442
39,2015-02-22 15:06:45,"Caf de Thaan Aoan, Prapokkloa Rd, 4021372d07400a352207432b2148",18.7856139353,98.988395966
40,2015-02-22 15:04:00,"Sri-Pat Guest House, 16 Soi 7 Moon Muang Rd, 28233520392134",18.792896,98.992702
41,2015-02-22 15:02:30,"Historic Town of Sukhothai, 16.0823142734163516482d07, 2a384202173122",17.0189532488,99.7037816048
42,2015-02-22 15:01:00,"Orchid Hibiscus Guest House, Sukhothai, Mueang Kao",17.013531276,99.7156282517
43,2015-02-22 14:57:05,"Wat Maha That, Chikun Rd., 1e23301904232823352d2238182232",14.3563453907,100.568162263
44,2015-02-22 14:54:00,"Sai Thong River, 45 U-thong Rd, Pratu Chai",14.3474504078,100.569547127
45,2015-02-22 14:51:27,"The Jim Thompson House, 6 Soi Kasem San 2, 1e2330190423",13.7491397275,100.52844286
46,2015-02-22 14:48:24,"Wat Pho, 2 Sanam Chai Rd, 1e2330190423",13.7466164586,100.492153145
47,2015-02-22 14:46:12,"Graph Caf, Rachawithi Soi 2, 4021372d07400a352207432b2148",18.791642,98.991527
48,2015-01-24 04:55:05,"G-Factory @Siam Center, Siam center, 1b173821273119",13.7460737331,100.532360864
49,2014-12-30 00:25:55,"Galeto, Av. da Repblica, 14A, Lisboa",38.7356786677,-9.14528825797
50,2014-12-03 00:22:44,"Barbearia Oliveira, Rua dos Remdios, 27, Lisboa",38.7118262492,-9.12742141184
51,2014-12-03 00:20:33,"Colorfoto MegaStore, Praca de Alvalade, Lisboa",38.7527445794,-9.14476633072
52,2014-12-03 00:19:01,"Malaca Too, R. Rodrigues Faria, 103, Lisboa",38.702573,-9.178666
53,2014-11-02 17:04:13,"Ori, C. C. Colombo, Lisboa",38.7551582942,-9.1885883806
54,2014-10-21 02:59:16,"Riu Palace Meloneras, Urb. Las Meloneras, Maspalomas",27.7395140834,-15.6029194793
55,2014-10-21 02:53:20,"Aeropuerto de Gran Canaria (LPA), Ctra General del Sur, Telde",27.9379006963,-15.3891829106
56,2014-10-10 16:31:05,"Sakura, Av. Infante Santo, 60B, Lisboa",38.7085053748,-9.16708767414
57,2014-10-10 16:29:16,"MAAT, Av. de Braslia, Lisboa",38.6958435245,-9.1933465004
58,2014-10-10 16:27:25,"Torres, C. C. Colombo, Lisboa",38.754903,-9.188261
59,2014-10-10 16:25:39,"LX Factory, R. Rodrigues Faria 103, Lisboa",38.7030914752,-9.17883313641
60,2014-10-10 16:22:10,"Tarik, C. C. Portela, R/C, Loja 10, Portela",38.7820897387,-9.1112279892
61,2014-09-23 21:54:34,"Burger Factory, Rua Rodrigues Faria, 103, Lisboa",38.7022490389,-9.17803108692
62,2014-08-29 04:41:02,"Hotel Savoy Boutique *****, Suur-Karja 17/19, Tallinn Old Town",59.4348855059,24.7467959583
63,2014-08-29 04:35:54,"Valli Baar, Mrivahe 16, Tallinn",59.4351109815,24.7457114498
64,2014-08-29 04:34:41,"Pdaste mis, Muhu saar, Pdaste",58.5502152219,23.2795533324
65,2014-08-29 04:31:45,"Frost Boutique Hotel, Kuninga 11, Prn",58.3835863625,24.4986783825
66,2014-08-29 04:29:13,"London Hotel, Ruutli 9, Tartu Parish",58.3810442178,26.7222706548
67,2014-08-29 04:27:11,"Teaduskeskus AHHAA, Sadama 1, Tart",58.3766169919,26.7340633759
